{
  "tid": "00000000-0000-4000-8000-000000000007",
  "bid": "00000000-0000-4000-8000-000000000008",
  "timestamp": 1790000000000,
  "gateway": "SOTESTDOCK01",
  "data": {
    "latitude": 45.0,
    "longitude": 7.0,
    "elevation": 10.0,
    "home_distance": 0.0,
    "attitude_head": 90.0,
    "battery": {
      "capacity_percent": 80
    },
    "position_state": {
      "gps_number": 17,
      "quality": 5
    },
    "mode_code": 5
  }
}
